{
  "candidate_id": "standalone-transformation-example",
  "candidate_name": "Standalone Transformation Example",
  "record_date": "2026-03-23",
  "transformation_type": "maintainability",
  "discovery_intake_path": "discovery/01-intake/2026-03-23-standalone-transformation-intake.md",
  "component": "standalone-host Runtime transformation lane",
  "current_implementation": "Transformation artifacts existed as templates and historical records without a canonical standalone-host writer path.",
  "baseline_metric": "manual_transformation_recording_steps",
  "baseline_value": "2",
  "baseline_measurement_method": "count proof artifact authoring plus transformation record authoring before the standalone transformation helper existed",
  "proposed_change": "Add canonical transformation-proof and transformation-record writers plus standalone-host CLI/API support.",
  "preservation_claim": "Keep the transformation-proof schema shape and the transformation-record operating fields while making emission product-owned.",
  "expected_improvement_metric": "manual_transformation_recording_steps",
  "expected_target_value": "1",
  "expected_measurement_method": "count the remaining operator step once canonical writers exist",
  "evaluator_type": "automated",
  "evaluator_command": "npm run check:directive-standalone-runtime-host && npm run check:directive-standalone-api-host",
  "comparison_mode": "before-after",
  "baseline_artifact_path": "runtime/03-proof/2026-03-23-standalone-transformation-example-transformation-proof.json",
  "result_artifact_path": "runtime/03-proof/2026-03-23-standalone-transformation-example-transformation-proof.json",
  "correctness_preserved": "yes - the transformation proof still satisfies the canonical schema and the standalone host still stays bounded/local",
  "metric_improvement_measured": "yes - one canonical helper now emits the transformation proof artifact shape",
  "rollback_path": "Delete the generated transformation proof and transformation record artifacts.",
  "rollback_tested": "yes - bounded local artifacts only",
  "decision_state": "evaluated",
  "mission_alignment": "Improve Runtime's behavior-preserving transformation lane as part of Directive Workspace system quality.",
  "capability_gap_id": "gap-transformation-lane"
}
